{
  "updated_at_ms": 1790000010000,
  "agent": {
    "version": "0.1.0",
    "uptime_s": 3610,
    "queue_len": 0
  },
  "bridge_state": "ready",
  "mission_state": "idle",
  "tracking_state": "idle",
  "trip_id": null,
  "from_place_id": null,
  "to_place_id": null,
  "battery_percent": null,
  "last_error": null,
  "phone_link": {
    "connected": true,
    "last_seen_ms": 1790000009000
  },
  "base": {
    "agent_state": "connected",
    "cmd_watchdog_ok": true,
    "last_seen_ms": 1790000009900
  }
}
